<?xml version="1.0" encoding="UTF-8"?>
<vendeglatas xmlns:xsi="http://www.w3.org/2001/XMLSchema-instance" xsi:noNamespaceSchemaLocation="OE8BW9_XMLSchema.xsd">
    <etterem ekod="e1">
        <nev>Trofea</nev>
        <cím>
            <varos>Budapest</varos>
                <utca>Visegrádi</utca>
                <hazszam> 12</hazszam>
            </cím>
        <csillag>4</csillag>
    </etterem>
    <etterem ekod="e2">
        <nev>Gundel</nev>
        <cím>
            <varos>Budapest</varos>
                <utca>Gundel Károly</utca>
                <hazszam>4</hazszam>
            </cím>
        <csillag>5</csillag>
    </etterem>

 <!-- FoSzakacsok -->
    <foszakacs fkod="f1" e_f="e1">
        <nev>Havas Péter</nev>
        <eletkor>35</eletkor>
        <vegzettseg>Szakközépiskola</vegzettseg>
        <vegzettseg>Institut Paul Bocuse</vegzettseg>
    </foszakacs>

    <foszakacs fkod="f2" e_f="e2">
        <nev>Nagy Károly</nev>
        <eletkor>30</eletkor>
        <vegzettseg>Le Cordon Bleu</vegzettseg>
    </foszakacs>
    
    <!-- Szakacsok -->
     <szakacs szkod="sz1" e_sz="e1">
        <nev>Ötlet Elek</nev>
        <reszleg>Saucier</reszleg>
        <vegzettseg>Szakközépiskola</vegzettseg>
        <vegzettseg>Le Cordon Bleu</vegzettseg>
        <vegzettseg>Institut Paul Bocuse</vegzettseg>
     </szakacs>

     <szakacs szkod="sz2" e_sz="e2">
        <nev>Kocsis Tibor</nev>
        <reszleg>Entremiter</reszleg>
        <vegzettseg>Szakközépiskola</vegzettseg>
        <vegzettseg>Le Cordon Bleu</vegzettseg>
     </szakacs>

     <szakacs szkod="sz3" e_sz="e3">
        <nev>Tálas Levente</nev>
        <reszleg>Gardemenger</reszleg>
        <vegzettseg>Szakközépiskola</vegzettseg>
     </szakacs>

     <szakacs szkod="sz4" e_sz="e4">
        <nev>Szúcs Judit</nev>
        <reszleg>Entremetier</reszleg>
        <vegzettseg>La Cordon Bleu</vegzettseg>
        <vegzettseg>Institut Paul Bocuse</vegzettseg>
     </szakacs>

     <!-- Gyakornokok -->
    <gyakornok gykod="g1" e_gy="e1">
        <nev>Szilágyi István</nev>
        <gyakorlat>
            <kezdet>2021.06.01</kezdet>
            <időtartam>4 hónap</időtartam>
        </gyakorlat>
        <muszak>Délután</muszak>
    </gyakornok>

    <gyakornok gykod="g2" e_gy="e2">
        <nev>Bordás Dávid</nev>
        <gyakorlat>
            <kezdet>2021.08.20</kezdet>
            <időtartam>2 hónap</időtartam>
        </gyakorlat>
        <muszak>Délelőtt</muszak>
        <muszak>Este</muszak>
    </gyakornok>

    <gyakornok gykod="g3" e_gy="e3">
        <nev>Kis Ferenc</nev>
        <gyakorlat>
            <kezdet>2021.09.19</kezdet>
            <időtartam>6 hónap</időtartam>
        </gyakorlat>
        <muszak>Délelőtt</muszak>
        <muszak>Este</muszak>
    </gyakornok>

    <vendeg vkod="v1" e_v="e1">
        <nev>Fekete Péter</nev>
        <eletkor>21</eletkor>
        <cím>
            <varos>Budapest</varos>
                <utca>Visegrádi</utca>
                <hazszam> 12</hazszam>
        </cím>
    </vendeg>
    
    <vendeg vkod="v2" e_v="e2">
        <nev>Fekete Péter</nev>
        <eletkor>21</eletkor>
        <cím>
            <varos>Budapest</varos>
                <utca>Visegrádi</utca>
                <hazszam> 12</hazszam>
        </cím>
    </vendeg>

    <rendeles  e_v_e="v1" e_v_v="e1">
        <osszeg>90000</osszeg>
        <etel>Steak</etel>
    </rendeles>

    <rendeles  e_v_e="v2" e_v_v="e2">
        <osszeg>18000</osszeg>
        <etel>Zsíros kenyér</etel>
    </rendeles>

    <rendeles  e_v_e="v3" e_v_v="e3">
        <osszeg>50000</osszeg>
        <etel>Gundel palacsinta</etel>
    </rendeles>

    <rendeles  e_v_e="v4" e_v_v="e4">
        <osszeg>90000</osszeg>
        <etel>Sajt</etel>
    </rendeles>

</vendeglatas>
